[
    {
        "sku": "CB94602SM02",
        "name": "Wi-fi Switch 2 Channel - Mountain Grey",
        "product_family": "ENCONNECT",
        "category": "Switches",
        "subcategory": "Wi-fi Switch",
        "specs": {
            "ampere": null,
            "color": "Mountain Grey",
            "mw": 2,
            "has_indicator": true,
            "type_detail": "2 Channel"
        },
        "variant": [
            "CB94602SB02",
            "CB94602SL02"
        ],
        "pricing": {
            "mrp": 7500,
            "discount": null,
            "selling_price": null,
            "std_pack": "1"
        },
        "media": {
            "images": [],
            "documents": []
        },
        "seo": {
            "slug": "wi-fi-switch-2-channel-mountain-grey",
            "keywords": [
                "Wi-fi Switch",
                "2 Channel",
                "Mountain Grey",
                "Smart Switch"
            ],
            "meta_description": "Buy Wi-fi Switch 2 Channel Mountain Grey online at New Delhi Electricals. Smart home automation switch."
        },
        "status": {
            "is_active": true,
            "is_featured": false
        },
        "brand": "Lauritz Knudsen"
    },
    {
        "sku": "CB94602SB02",
        "name": "Wi-fi Switch 2 Channel - Sparkle Black",
        "product_family": "ENCONNECT",
        "category": "Switches",
        "subcategory": "Wi-fi Switch",
        "specs": {
            "ampere": null,
            "color": "Sparkle Black",
            "mw": 2,
            "has_indicator": true,
            "type_detail": "2 Channel"
        },
        "variant": [
            "CB94602SM02",
            "CB94602SL02"
        ],
        "pricing": {
            "mrp": 7500,
            "discount": null,
            "selling_price": null,
            "std_pack": "1"
        },
        "media": {
            "images": [],
            "documents": []
        },
        "seo": {
            "slug": "wi-fi-switch-2-channel-sparkle-black",
            "keywords": [
                "Wi-fi Switch",
                "2 Channel",
                "Sparkle Black",
                "Smart Switch"
            ],
            "meta_description": "Buy Wi-fi Switch 2 Channel Sparkle Black online at New Delhi Electricals. Smart home automation switch."
        },
        "status": {
            "is_active": true,
            "is_featured": false
        },
        "brand": "Lauritz Knudsen"
    },
    {
        "sku": "CB94602SL02",
        "name": "Wi-fi Switch 2 Channel - Black Glass",
        "product_family": "ENCONNECT",
        "category": "Switches",
        "subcategory": "Wi-fi Switch",
        "specs": {
            "ampere": null,
            "color": "Black Glass",
            "mw": 2,
            "has_indicator": true,
            "type_detail": "2 Channel"
        },
        "variant": [
            "CB94602SM02",
            "CB94602SB02"
        ],
        "pricing": {
            "mrp": 7900,
            "discount": null,
            "selling_price": null,
            "std_pack": "1"
        },
        "media": {
            "images": [],
            "documents": []
        },
        "seo": {
            "slug": "wi-fi-switch-2-channel-black-glass",
            "keywords": [
                "Wi-fi Switch",
                "2 Channel",
                "Black Glass",
                "Smart Switch"
            ],
            "meta_description": "Buy Wi-fi Switch 2 Channel Black Glass online at New Delhi Electricals. Premium smart home automation switch."
        },
        "status": {
            "is_active": true,
            "is_featured": false
        },
        "brand": "Lauritz Knudsen"
    },
    {
        "sku": "CB94602SM04",
        "name": "Wi-fi Switch 4 Channel - Mountain Grey",
        "product_family": "ENCONNECT",
        "category": "Switches",
        "subcategory": "Wi-fi Switch",
        "specs": {
            "ampere": null,
            "color": "Mountain Grey",
            "mw": 2,
            "has_indicator": true,
            "type_detail": "4 Channel"
        },
        "variant": [
            "CB94602SB04",
            "CB94602SL04"
        ],
        "pricing": {
            "mrp": 9500,
            "discount": null,
            "selling_price": null,
            "std_pack": "1"
        },
        "media": {
            "images": [],
            "documents": []
        },
        "seo": {
            "slug": "wi-fi-switch-4-channel-mountain-grey",
            "keywords": [
                "Wi-fi Switch",
                "4 Channel",
                "Mountain Grey",
                "Smart Switch"
            ],
            "meta_description": "Buy Wi-fi Switch 4 Channel Mountain Grey online at New Delhi Electricals."
        },
        "status": {
            "is_active": true,
            "is_featured": false
        },
        "brand": "Lauritz Knudsen"
    },
    {
        "sku": "CB94602SB04",
        "name": "Wi-fi Switch 4 Channel - Sparkle Black",
        "product_family": "ENCONNECT",
        "category": "Switches",
        "subcategory": "Wi-fi Switch",
        "specs": {
            "ampere": null,
            "color": "Sparkle Black",
            "mw": 2,
            "has_indicator": true,
            "type_detail": "4 Channel"
        },
        "variant": [
            "CB94602SM04",
            "CB94602SL04"
        ],
        "pricing": {
            "mrp": 9500,
            "discount": null,
            "selling_price": null,
            "std_pack": "1"
        },
        "media": {
            "images": [],
            "documents": []
        },
        "seo": {
            "slug": "wi-fi-switch-4-channel-sparkle-black",
            "keywords": [
                "Wi-fi Switch",
                "4 Channel",
                "Sparkle Black",
                "Smart Switch"
            ],
            "meta_description": "Buy Wi-fi Switch 4 Channel Sparkle Black online at New Delhi Electricals."
        },
        "status": {
            "is_active": true,
            "is_featured": false
        },
        "brand": "Lauritz Knudsen"
    },
    {
        "sku": "CB94602SL04",
        "name": "Wi-fi Switch 4 Channel - Black Glass",
        "product_family": "ENCONNECT",
        "category": "Switches",
        "subcategory": "Wi-fi Switch",
        "specs": {
            "ampere": null,
            "color": "Black Glass",
            "mw": 2,
            "has_indicator": true,
            "type_detail": "4 Channel"
        },
        "variant": [
            "CB94602SM04",
            "CB94602SB04"
        ],
        "pricing": {
            "mrp": 9900,
            "discount": null,
            "selling_price": null,
            "std_pack": "1"
        },
        "media": {
            "images": [],
            "documents": []
        },
        "seo": {
            "slug": "wi-fi-switch-4-channel-black-glass",
            "keywords": [
                "Wi-fi Switch",
                "4 Channel",
                "Black Glass",
                "Smart Switch"
            ],
            "meta_description": "Buy Wi-fi Switch 4 Channel Black Glass online at New Delhi Electricals."
        },
        "status": {
            "is_active": true,
            "is_featured": false
        },
        "brand": "Lauritz Knudsen"
    },
    {
        "sku": "CB94602SM20",
        "name": "Wi-fi Switch 20A for Power Load - Mountain Grey",
        "product_family": "ENCONNECT",
        "category": "Switches",
        "subcategory": "Wi-fi Power Switch",
        "specs": {
            "ampere": 20,
            "color": "Mountain Grey",
            "mw": 2,
            "has_indicator": true,
            "type_detail": "Power Load"
        },
        "variant": [
            "CB94602SB20",
            "CB94602SL20"
        ],
        "pricing": {
            "mrp": 9500,
            "discount": null,
            "selling_price": null,
            "std_pack": "1"
        },
        "media": {
            "images": [],
            "documents": []
        },
        "seo": {
            "slug": "wi-fi-switch-20a-for-power-load-mountain-grey",
            "keywords": [
                "Wi-fi Switch",
                "20A",
                "Power Load",
                "Mountain Grey"
            ],
            "meta_description": "Buy Wi-fi Switch 20A for Power Load Mountain Grey online at New Delhi Electricals."
        },
        "status": {
            "is_active": true,
            "is_featured": false
        },
        "brand": "Lauritz Knudsen"
    },
    {
        "sku": "CB94602SB20",
        "name": "Wi-fi Switch 20A for Power Load - Sparkle Black",
        "product_family": "ENCONNECT",
        "category": "Switches",
        "subcategory": "Wi-fi Power Switch",
        "specs": {
            "ampere": 20,
            "color": "Sparkle Black",
            "mw": 2,
            "has_indicator": true,
            "type_detail": "Power Load"
        },
        "variant": [
            "CB94602SM20",
            "CB94602SL20"
        ],
        "pricing": {
            "mrp": 9500,
            "discount": null,
            "selling_price": null,
            "std_pack": "1"
        },
        "media": {
            "images": [],
            "documents": []
        },
        "seo": {
            "slug": "wi-fi-switch-20a-for-power-load-sparkle-black",
            "keywords": [
                "Wi-fi Switch",
                "20A",
                "Power Load",
                "Sparkle Black"
            ],
            "meta_description": "Buy Wi-fi Switch 20A for Power Load Sparkle Black online at New Delhi Electricals."
        },
        "status": {
            "is_active": true,
            "is_featured": false
        },
        "brand": "Lauritz Knudsen"
    },
    {
        "sku": "CB94602SL20",
        "name": "Wi-fi Switch 20A for Power Load - Black Glass",
        "product_family": "ENCONNECT",